title,address,color
"Institut Limayrac","Institut de Formation Limayrac, 50, Rue de Limayrac, Côte Pavée, Château de l'Hers, Limayrac, Toulouse Est, Toulouse, Haute-Garonne, Occitanie, France métropolitaine, 31079, France","red"
"Place du Capitole","Croix occitane et ses 12 signes du zodiaque, Place du Capitole, Place Occitane, Capitole, Toulouse Centre, Toulouse, Haute-Garonne, Occitanie, France métropolitaine, 31000, France","blue"
"Musée des Augustins","Musée des Augustins, Rue Antonin Mercié, Place Occitane, Capitole, Toulouse Centre, Toulouse, Haute-Garonne, Occitanie, France métropolitaine, 31000, France","green"
"Basilique Saint-Sernin","Basilique Saint-Sernin, Place Saint-Sernin, Place Occitane, Capitole, Toulouse Centre, Toulouse, Haute-Garonne, Occitanie, France métropolitaine, 31000, France","red"
"Cité de l'Espace","Cité de l'Espace, Rue Maurice Hurel, Côte Pavée, Château de l'Hers, Limayrac, Toulouse Est, Toulouse, Haute-Garonne, Occitanie, France métropolitaine, 31500, France","blue"